{
  "$schema": "https://json-schema.org/draft/2020-12/schema",
  "$id": "ekg-development-candidate-manifest-v1",
  "type": "object",
  "additionalProperties": false,
  "required": ["schema", "candidateId", "task", "createdAtUtc", "clinicalAccuracyClaimed", "runtimeAuthority", "artifacts", "executionIdentitySha256", "manifestPayloadSha256"],
  "properties": {
    "schema": {"const": "ekg-development-candidate-manifest-v1"},
    "candidateId": {"type": "string", "minLength": 1},
    "task": {"const": "R_PEAK_DETECTION"},
    "createdAtUtc": {"type": "string", "pattern": "^\\d{4}-\\d{2}-\\d{2}T\\d{2}:\\d{2}:\\d{2}Z$"},
    "clinicalAccuracyClaimed": {"const": false},
    "runtimeAuthority": {"const": false},
    "artifacts": {
      "type": "array",
      "minItems": 1,
      "items": {
        "type": "object",
        "additionalProperties": false,
        "required": ["file", "bytes", "sha256"],
        "properties": {
          "file": {"type": "string", "pattern": "^(lib|evaluation/protocols)/[A-Za-z0-9_.-]+\\.(js|json)$"},
          "bytes": {"type": "integer", "minimum": 1, "maximum": 2097152},
          "sha256": {"type": "string", "pattern": "^[0-9a-f]{64}$"}
        }
      }
    },
    "executionIdentitySha256": {"type": "string", "pattern": "^[0-9a-f]{64}$"},
    "manifestPayloadSha256": {"type": "string", "pattern": "^[0-9a-f]{64}$"}
  }
}
